{
  "$schema": "http://json-schema.org/draft-07/schema#",
  "$id": "https://github.com/fakebranden/fga-pro-max-skill/blob/main/tokens/tokens.schema.json",
  "title": "FGA Pro Max — Token Set",
  "description": "Schema for token JSON files (canonical + seeds + playwright-cached extractions). A token set is a complete refero-style design system: colors with semantic names, display + body typography, spacing rhythm, radii, and anti-patterns documenting banned uses.",
  "type": "object",
  "required": [
    "id",
    "name",
    "description",
    "source",
    "extractedAt",
    "extractionMethod",
    "tokens",
    "antiPatterns"
  ],
  "additionalProperties": true,
  "properties": {
    "$schema": {
      "type": "string",
      "description": "Path to this schema file (relative or absolute). Optional but recommended."
    },
    "id": {
      "type": "string",
      "pattern": "^[a-z0-9]+(?:-[a-z0-9]+)*$",
      "description": "Slug identifier — must match the filename without .json extension."
    },
    "name": {
      "type": "string",
      "minLength": 2,
      "description": "Display name for operator-facing UIs."
    },
    "description": {
      "type": "string",
      "minLength": 10,
      "description": "1–3 sentence summary of the style's character and intended use."
    },
    "source": {
      "type": "string",
      "description": "URL the system was extracted from, or 'manual-seed' for hand-authored token sets."
    },
    "extractedAt": {
      "type": "string",
      "format": "date",
      "description": "ISO date (YYYY-MM-DD) the token set was captured."
    },
    "extractionMethod": {
      "type": "string",
      "enum": [
        "manual-seed",
        "manual-curated",
        "playwright-scrape",
        "refero-extract"
      ],
      "description": "How the token values were obtained. manual-seed = hand-authored from scratch (e.g. FGA canonical). manual-curated = hand-extracted by observation. playwright-scrape = output of scripts/extract-tokens.mjs. refero-extract = pulled from refero.design or equivalent tooling."
    },
    "tokens": {
      "type": "object",
      "required": ["colors", "typography", "spacing", "radii"],
      "additionalProperties": false,
      "properties": {
        "colors": {
          "type": "object",
          "description": "Semantic colors. Keys MUST follow --color-<adjective>-<noun> naming. At least 5 entries required.",
          "minProperties": 5,
          "patternProperties": {
            "^--color-[a-z]+(?:-[a-z]+)+$": {
              "type": "object",
              "required": ["value", "role", "context"],
              "additionalProperties": false,
              "properties": {
                "value": {
                  "type": "string",
                  "description": "Hex color, rgb(...), or 'TBD-verify' if unverified.",
                  "pattern": "^(#[0-9A-Fa-f]{3,8}|rgba?\\([^)]+\\)|hsla?\\([^)]+\\)|TBD-verify)$"
                },
                "role": {
                  "type": "string",
                  "minLength": 5,
                  "description": "Semantic intent — what this color is FOR."
                },
                "context": {
                  "type": "string",
                  "minLength": 3,
                  "description": "1-line plain-English description of the color's character."
                }
              }
            }
          },
          "additionalProperties": false
        },
        "typography": {
          "type": "object",
          "description": "Font families. Must include at least one display and one body font (by --font-display-* and --font-body-* keys).",
          "minProperties": 2,
          "patternProperties": {
            "^--font-(display|body|mono|accent)-[a-z0-9-]+$": {
              "type": "object",
              "required": ["value", "role"],
              "additionalProperties": false,
              "properties": {
                "value": {
                  "type": "string",
                  "description": "CSS font-family stack."
                },
                "role": {
                  "type": "string",
                  "minLength": 5,
                  "description": "What this font is used for (e.g. 'hero headlines', 'body copy')."
                },
                "weights": {
                  "type": "array",
                  "items": { "type": "integer", "minimum": 100, "maximum": 1000 },
                  "minItems": 1,
                  "description": "Weights actually used (e.g. [400, 600])."
                },
                "sizes": {
                  "type": "string",
                  "description": "Plain-English size guidance — e.g. 'up to 300px' or '12px / 14px / 16px'."
                }
              }
            }
          },
          "additionalProperties": false
        },
        "spacing": {
          "type": "object",
          "description": "Spacing scale. At least 3 entries required. Values are CSS-ready strings (clamp(), px, rem).",
          "minProperties": 3,
          "patternProperties": {
            "^--space-[a-z0-9-]+$": { "type": "string", "minLength": 2 }
          },
          "additionalProperties": false
        },
        "radii": {
          "type": "object",
          "description": "Border-radius scale. At least 3 entries required.",
          "minProperties": 3,
          "patternProperties": {
            "^--radius-[a-z0-9-]+$": { "type": "string", "minLength": 2 }
          },
          "additionalProperties": false
        }
      }
    },
    "antiPatterns": {
      "type": "array",
      "description": "Banned uses of these tokens for THIS style — guardrails the design layer enforces. At least 2 entries required.",
      "minItems": 2,
      "items": { "type": "string", "minLength": 20 }
    },
    "_unverified": {
      "type": "array",
      "description": "Optional list of token keys whose values are best-effort and need manual verification. Token-extractor scripts may populate this list.",
      "items": { "type": "string" }
    }
  }
}
