{
  "$schema": "../tokens.schema.json",
  "id": "elevenlabs",
  "name": "ElevenLabs",
  "description": "Audio-creative reference — deep blacks anchor the canvas while electric glow accents (cyan + warm violet) suggest waveform energy. Technical-warm: serif display moments over geometric body type. Black is the medium; light is the message.",
  "source": "https://elevenlabs.io",
  "extractedAt": "2026-05-31",
  "extractionMethod": "manual-curated",
  "tokens": {
    "colors": {
      "--color-obsidian-deep": {
        "value": "#000000",
        "role": "Primary surface — page background, hero base, dark-mode default",
        "context": "true black, the canvas everything glows against"
      },
      "--color-cloud-whisper": {
        "value": "#FFFFFF",
        "role": "Primary text on black, CTA surface for inverted buttons",
        "context": "pure white, the high-contrast voice"
      },
      "--color-shadow-surface": {
        "value": "#0E0E0E",
        "role": "Elevated dark surface — card fills, modal backgrounds, audio-player chrome",
        "context": "slightly-lifted black, near-imperceptible step from obsidian-deep"
      },
      "--color-lagoon-glow": {
        "value": "#00D9FF",
        "role": "Signature accent — waveform highlights, key CTAs, link states",
        "context": "electric cyan, suggests live audio"
      },
      "--color-violet-pulse": {
        "value": "#7C5CFF",
        "role": "Secondary accent — gradient partner with lagoon-glow, hover states",
        "context": "warm violet, the human-warm counterweight to cyan"
      },
      "--color-graphite-body": {
        "value": "#A1A1AA",
        "role": "Secondary text on black — captions, supporting copy",
        "context": "mid-grey calibrated for legibility on true black"
      },
      "--color-ash-divider": {
        "value": "#27272A",
        "role": "Hairline dividers, low-emphasis borders on dark surfaces",
        "context": "near-black with just enough lift to register"
      }
    },
    "typography": {
      "--font-display-instrument": {
        "value": "\"Instrument Serif\", \"Times New Roman\", serif",
        "role": "Display headlines and editorial pull-quotes — the warm contrast moment against geometric body",
        "weights": [400],
        "sizes": "48px / 72px / 120px hero"
      },
      "--font-body-inter": {
        "value": "\"Inter\", system-ui, sans-serif",
        "role": "Body copy, navigation, technical labels, UI chrome",
        "weights": [400, 500, 600],
        "sizes": "13px / 15px / 17px"
      }
    },
    "spacing": {
      "--space-tight": "clamp(8px, 1vw, 12px)",
      "--space-base": "clamp(16px, 2vw, 24px)",
      "--space-loose": "clamp(32px, 4vw, 56px)",
      "--space-section": "clamp(64px, 8vw, 128px)"
    },
    "radii": {
      "--radius-tight": "4px",
      "--radius-card": "12px",
      "--radius-pill": "9999px",
      "--radius-hero": "20px"
    }
  },
  "antiPatterns": [
    "Never use --color-lagoon-glow and --color-violet-pulse simultaneously as solid blocks — they exist as gradient partners or paired-glow effects. Solid side-by-side reads as Twitch overlay, not audio brand.",
    "Never set --color-obsidian-deep against --color-shadow-surface without a glow or divider — the contrast step is too subtle to register, the section will look broken.",
    "Body type must NOT use --font-display-instrument — Instrument Serif at body sizes looks like a Substack draft. Reserve serif strictly for display moments and pull-quotes.",
    "Never apply --color-graphite-body to white surfaces — this palette is dark-first. Light-mode adaptations must redefine the body color, not invert the dark-mode token."
  ]
}
