{
  "$schema": "../tokens.schema.json",
  "id": "linear",
  "name": "Linear",
  "description": "Productivity reference — dark-first canvas, geometric Inter at every size, indigo-violet signature accent, dense information design. Type is small, leading is tight, hierarchy is encoded in weight and color not size.",
  "source": "https://linear.app",
  "extractedAt": "2026-05-31",
  "extractionMethod": "manual-curated",
  "tokens": {
    "colors": {
      "--color-midnight-void": {
        "value": "#08090A",
        "role": "Primary surface — page background, the canvas everything sits on",
        "context": "near-black with a microscopic cool tint"
      },
      "--color-shadow-surface": {
        "value": "#1C1D1F",
        "role": "Elevated dark surface — card fills, modal backgrounds, sidebars",
        "context": "lifted dark grey, the second-elevation step"
      },
      "--color-cloud-whisper": {
        "value": "#F7F8F8",
        "role": "Primary text on midnight-void — headlines, key UI labels",
        "context": "off-white, calibrated to not glare on near-black"
      },
      "--color-graphite-body": {
        "value": "#8A8F98",
        "role": "Secondary body text, captions, metadata",
        "context": "mid-cool-grey, the productive-supporting voice"
      },
      "--color-violet-spark": {
        "value": "#5E6AD2",
        "role": "Signature accent — CTAs, active states, focus rings, brand-defining hue",
        "context": "Linear indigo-violet, the brand's identity color"
      },
      "--color-ash-divider": {
        "value": "#26282E",
        "role": "Hairline dividers, list separators, low-emphasis borders",
        "context": "barely-visible step from midnight-void"
      },
      "--color-fog-muted": {
        "value": "#62666D",
        "role": "Tertiary text, disabled states, timestamps",
        "context": "darker grey for de-emphasized info"
      }
    },
    "typography": {
      "--font-display-inter": {
        "value": "\"Inter\", -apple-system, BlinkMacSystemFont, sans-serif",
        "role": "Display headlines — hero, section titles, marketing-page H1",
        "weights": [500, 600, 700],
        "sizes": "36px / 56px / 72px"
      },
      "--font-body-inter": {
        "value": "\"Inter\", -apple-system, BlinkMacSystemFont, sans-serif",
        "role": "Body copy, UI chrome, list items, navigation",
        "weights": [400, 500, 600],
        "sizes": "13px / 14px / 15px"
      }
    },
    "spacing": {
      "--space-tight": "4px",
      "--space-base": "8px",
      "--space-loose": "16px",
      "--space-section": "clamp(48px, 6vw, 96px)"
    },
    "radii": {
      "--radius-tight": "4px",
      "--radius-card": "8px",
      "--radius-modal": "12px",
      "--radius-pill": "9999px"
    }
  },
  "antiPatterns": [
    "Body text must never exceed 16px — Linear hierarchy is encoded in weight (500 vs 400) and color (cloud-whisper vs graphite-body), not in size. Large body type breaks the productivity character.",
    "Never apply --color-violet-spark to large surface fills — Linear uses it as a 1–3% accent (button bg, active state, focus ring). As a section background it looks like a generic gradient SaaS.",
    "Never use serif typography anywhere — the Linear voice is monoculturally Inter. A serif headline reads as a different brand entirely.",
    "Avoid drop-shadows on dark surfaces — Linear separates layers via color-step (midnight-void → shadow-surface → ash-divider), never shadow blur. Soft shadows on dark mode look like Notion, not Linear."
  ]
}
